{
  "schema_version": "agency-artifact/1.0",
  "artifact_id": "art_example_brief",
  "artifact_type": "brief",
  "title": "Бриф: шаблон для заполнения",
  "scope": "template",
  "project_id": null,
  "department": "content",
  "topic": [
    "article",
    "visuals"
  ],
  "task_ref": null,
  "owner": {
    "kind": "role",
    "id": null
  },
  "status": "draft",
  "version": 1,
  "created_at": "2026-09-14T00:00:00+02:00",
  "updated_at": "2026-09-14T00:00:00+02:00",
  "access": "internal",
  "language": "ru",
  "source_refs": [],
  "depends_on": [],
  "review": null,
  "extensions": {}
}
